{ "ts": 1790000000, "fw": "1.0.0",
  "channels": [
    { "channel": 1, "state": "ON", "sessionId": "01J9ZQ3K8M4N5P6Q7R8S9T0V1W", "endAt": 1790003600 },
    { "channel": 2, "state": "OFF", "sessionId": null, "endAt": null },
    { "channel": 3, "state": "WARNING", "sessionId": "01J9ZQ3K8M4N5P6Q7R8S9T0V4Z", "endAt": 1790000200 },
    { "channel": 4, "state": "OFF", "sessionId": null, "endAt": null }
  ],
  "rssi": -61, "uptime": 86400, "bootReason": "POWERON", "lastAppliedCommandId": "01J9ZQ3K8M4N5P6Q7R8S9T0V2X" }
